{
  "$schema": "https://json-schema.org/draft/2020-12/schema",
  "$id": "https://github.com/shaug/compris/review-suite/evals/contracts/expectation.schema.json",
  "title": "Private review replay expectation",
  "description": "Private grading evidence for one case. This file never enters an executor request. `requirement` and `surface` may legitimately restate reviewer-visible packet content; every other field is blind and must be absent from the request payload.",
  "type": "object",
  "additionalProperties": false,
  "required": [
    "expectation_version",
    "case_id",
    "packet_valid",
    "expected_verdict",
    "material_root_causes",
    "accepted_non_findings"
  ],
  "properties": {
    "expectation_version": {
      "const": "1.0"
    },
    "case_id": {
      "type": "string",
      "pattern": "^[a-z0-9]+(-[a-z0-9]+)*$"
    },
    "packet_valid": {
      "type": "boolean"
    },
    "expected_verdict": {
      "enum": [
        "clean",
        "changes_required",
        "blocked"
      ]
    },
    "material_root_causes": {
      "type": "array",
      "items": {
        "type": "object",
        "additionalProperties": false,
        "required": [
          "id",
          "requirement",
          "trigger",
          "surface",
          "consequence",
          "severity",
          "equivalent_formulations"
        ],
        "properties": {
          "id": {
            "type": "string",
            "pattern": "^rc\\.[a-z0-9][a-z0-9-]*$"
          },
          "requirement": {
            "type": "string",
            "minLength": 1
          },
          "trigger": {
            "type": "string",
            "minLength": 1
          },
          "surface": {
            "type": "string",
            "minLength": 1
          },
          "consequence": {
            "type": "string",
            "minLength": 1
          },
          "severity": {
            "enum": [
              "blocking",
              "strong_recommendation"
            ]
          },
          "equivalent_formulations": {
            "type": "array",
            "minItems": 1,
            "items": {
              "type": "string",
              "minLength": 1
            }
          }
        }
      }
    },
    "accepted_non_findings": {
      "type": "array",
      "items": {
        "type": "object",
        "additionalProperties": false,
        "required": [
          "id",
          "description",
          "equivalent_formulations"
        ],
        "properties": {
          "id": {
            "type": "string",
            "pattern": "^anf\\.[a-z0-9][a-z0-9-]*$"
          },
          "description": {
            "type": "string",
            "minLength": 1
          },
          "equivalent_formulations": {
            "type": "array",
            "minItems": 1,
            "items": {
              "type": "string",
              "minLength": 1
            }
          }
        }
      }
    },
    "calibrated": {
      "description": "True when every equivalent formulation here was checked against prose a real reviewer actually returned, and a calibration set under review-suite/evals/calibration/ pins that behaviour. False when the formulations were written before any run existed and have never been confronted with real prose - in which case this case's recall is a statement about the expectation, not about the reviewer. Absent on a case that predates calibration. A scored case must be true: an uncalibrated expectation reports 0.0 recall against a correct reviewer, which is measured behaviour rather than a hypothesis.",
      "type": "boolean"
    }
  }
}
