{
  "expectation_version": "1.0",
  "case_id": "registry-client-layering",
  "packet_valid": true,
  "calibrated": false,
  "expected_verdict": "changes_required",
  "material_root_causes": [
    {
      "id": "rc.three-client-concepts-duplicate-binding",
      "requirement": "When one caller already threads a root and working directory through every method of a client, a second client for a different operation family should converge on the client already bound to those values.",
      "trigger": "Adding a client for a new operation family next to an existing one that already re-threads root and working directory, in a module that also already has a transport session bound to those exact values.",
      "surface": "_QueueMessageOps",
      "consequence": "A second client class is added that re-threads `registry_root` and `cwd` through every method exactly as the existing `_RecordMutationOps` already does, even though `_TransportSession` in the same module is already bound to both values at construction and exists specifically to avoid that repetition. Every caller of either operation client has to supply the same two values again at every call site, and this diff repeats rather than corrects the pattern.",
      "severity": "blocking",
      "equivalent_formulations": [
        "a third wrapper repeats the binding the transport session already holds",
        "root and working directory are passed at every call instead of once at construction",
        "these should share one already-bound session rather than three separate classes",
        "collapse the operation classes onto the session that already carries this state",
        "each operation class re-derives what the transport session already knows"
      ]
    }
  ],
  "accepted_non_findings": [
    {
      "id": "anf.private-class-naming",
      "description": "The three client classes are all leading-underscore private. A reviewer may ask whether that is intentional given they are imported across modules; it is a naming convention question independent of the layering defect this case is built from.",
      "equivalent_formulations": [
        "the classes are private but imported elsewhere",
        "underscore-prefixed classes crossing module boundaries"
      ]
    }
  ]
}
